"Timestamp","What is your name in M4C?","What movies would you like to see for the theme ""Worst Movies of the Past Two Years""?","What movies would you like to see for the theme ""Street Racing""?","What movies would you like to see for the theme ""Board Games""?","What movies would you like to see for Popular Movie Night?  Anything goes."
"2021/04/13 10:23:27 pm CET","","Sia's Music","Tokyo drift","","Narnia"
"2021/04/13 10:31:03 pm CET","","THE FANATIC","","Mouse trap","Thursday"
"2021/04/13 10:35:24 pm CET","","Cats, Loqueesha","Grease (1978), The Fast and the Furious: Tokyo Drift","Clue (1985)","Goodfellas"
"2021/04/14 12:14:41 am CET","","Money Plane.","The Cannonball Run","The Divine Move (2014)","O Brother, Where Art Thou"
"2021/04/14 12:28:05 am CET","","Locked Down, Cosmic Sin","Mischief 3000 - 2020 HD Remaster, Motorway (车手) 2012","Clue (1985), Pawn Sacrifice","Spy Kids, The Dark Knight Rises"
"2021/04/14 12:58:22 am CET","","","fast and furious 1","","Good Will Hunting"
"2021/04/14 3:37:00 am CET","","Lady Driver","Live-action Initial D; Tokyo Drift","The Surrounding Game","Sound of Metal"
"2021/04/14 10:21:14 pm CET","","Madea Family Funeral","Fast and the Furious: Tokyo Drift","Ouija","Godzilla vs Kong"
"2021/04/15 12:16:39 am CET","","dude i dont know any new movies from the last 2 years. captain marvel? sonic?","speed racer. 7fast 8 furious","Zathura (jumanji in space), battleship, clue","Casablanca, Blade Runner, Shawshank Redemption, Empire Strikes Back (original version Despecialized edition) "